<?xml version="1.0" encoding="UTF-8"?>
<mex 
	leadsheet-id="125" is-a-id="0" 
	title="A Felicidade" 
	xmlns="http://freebits.de/OMT-engine/schemas/MotivEXtraction" 
	xmlns:xsi="http://www.w3.org/2001/XMLSchema-instance" 
	xsi:schemaLocation="http://freebits.de/OMT-engine/schemas/MotivEXtraction motifextration.xsd ">
	<patterns>
		<node id="1" deltalength="2.0000" length="3.7500" tempo="180" beats-per-metre="2" beatlength="0.5000" deltatime-metre="0.0000">
			<note deltatone="0" deltatime="0.0000" length="1.2500" />
			<note deltatone="3" deltatime="1.2500" length="0.2500" />
			<note deltatone="-1" deltatime="0.2500" length="0.2500" />
			<note deltatone="-4" deltatime="0.2500" length="0.2500" />
			<note deltatone="-3" deltatime="0.2500" length="1.7500" />
		</node>
		<node id="2" deltalength="2.0000" length="4.0000" tempo="180" beats-per-metre="2" beatlength="0.5000" deltatime-metre="0.0000">
			<note deltatone="0" deltatime="0.0000" length="0.7500" />
			<note deltatone="-3" deltatime="0.7500" length="0.2500" />
			<note deltatone="2" deltatime="0.2500" length="0.7500" />
			<note deltatone="-3" deltatime="0.7500" length="0.2500" />
			<note deltatone="1" deltatime="0.2500" length="2.0000" />
		</node>
		<node id="3" deltalength="3.0000" length="3.7500" tempo="180" beats-per-metre="2" beatlength="0.5000" deltatime-metre="0.0000">
			<note deltatone="0" deltatime="0.0000" length="1.2500" />
			<note deltatone="3" deltatime="1.2500" length="0.2500" />
			<note deltatone="-2" deltatime="0.2500" length="0.2500" />
			<note deltatone="-1" deltatime="0.2500" length="0.2500" />
			<note deltatone="0" deltatime="0.2500" length="0.2500" />
			<note deltatone="-2" deltatime="0.2500" length="0.2500" />
			<note deltatone="-1" deltatime="0.2500" length="0.2500" />
			<note deltatone="1" deltatime="0.2500" length="0.2500" />
			<note deltatone="3" deltatime="0.2500" length="0.7500" />
		</node>
		<node id="4" deltalength="2.0000" length="4.0000" tempo="180" beats-per-metre="2" beatlength="0.5000" deltatime-metre="0.0000">
			<note deltatone="0" deltatime="0.0000" length="0.2500" />
			<note deltatone="-2" deltatime="0.2500" length="0.2500" />
			<note deltatone="-1" deltatime="0.2500" length="0.2500" />
			<note deltatone="1" deltatime="0.2500" length="0.2500" />
			<note deltatone="4" deltatime="0.2500" length="0.2500" />
			<note deltatone="-2" deltatime="0.2500" length="0.2500" />
			<note deltatone="-2" deltatime="0.2500" length="0.2500" />
			<note deltatone="2" deltatime="0.2500" length="0.2500" />
			<note deltatone="-4" deltatime="0.2500" length="2.0000" />
		</node>
		<node id="5" deltalength="0.7500" length="1.5000" tempo="180" beats-per-metre="2" beatlength="0.5000" deltatime-metre="0.2500">
			<note deltatone="0" deltatime="0.0000" length="0.2500" />
			<note deltatone="3" deltatime="0.2500" length="0.2500" />
			<note deltatone="2" deltatime="0.2500" length="0.2500" />
			<note deltatone="2" deltatime="0.2500" length="0.7500" />
		</node>
		<node id="6" deltalength="1.0000" length="1.7500" tempo="180" beats-per-metre="2" beatlength="0.5000" deltatime-metre="0.0000">
			<note deltatone="0" deltatime="0.0000" length="0.2500" />
			<note deltatone="3" deltatime="0.2500" length="0.2500" />
			<note deltatone="2" deltatime="0.2500" length="0.2500" />
			<note deltatone="2" deltatime="0.2500" length="0.2500" />
			<note deltatone="-2" deltatime="0.2500" length="0.7500" />
		</node>
		<node id="7" deltalength="2.0000" length="4.0000" tempo="180" beats-per-metre="2" beatlength="0.5000" deltatime-metre="0.0000">
			<note deltatone="0" deltatime="0.0000" length="0.2500" />
			<note deltatone="-1" deltatime="0.2500" length="0.2500" />
			<note deltatone="-1" deltatime="0.2500" length="0.2500" />
			<note deltatone="-7" deltatime="0.2500" length="0.2500" />
			<note deltatone="4" deltatime="0.2500" length="0.2500" />
			<note deltatone="-1" deltatime="0.2500" length="0.2500" />
			<note deltatone="-1" deltatime="0.2500" length="0.2500" />
			<note deltatone="-2" deltatime="0.2500" length="0.2500" />
			<note deltatone="-3" deltatime="0.2500" length="2.0000" />
		</node>
		<node id="8" deltalength="2.0000" length="2.2500" tempo="180" beats-per-metre="2" beatlength="0.5000" deltatime-metre="0.0000">
			<note deltatone="0" deltatime="0.0000" length="0.2500" />
			<note deltatone="2" deltatime="0.2500" length="0.2500" />
			<note deltatone="2" deltatime="0.2500" length="0.2500" />
			<note deltatone="1" deltatime="0.2500" length="0.2500" />
			<note deltatone="-3" deltatime="0.2500" length="0.2500" />
			<note deltatone="2" deltatime="0.2500" length="0.2500" />
			<note deltatone="1" deltatime="0.2500" length="0.2500" />
			<note deltatone="2" deltatime="0.2500" length="0.2500" />
			<note deltatone="-3" deltatime="0.2500" length="0.2500" />
		</node>
		<node id="9" deltalength="2.0000" length="3.7500" tempo="180" beats-per-metre="2" beatlength="0.5000" deltatime-metre="0.0000">
			<note deltatone="0" deltatime="0.0000" length="0.2500" />
			<note deltatone="2" deltatime="0.2500" length="0.2500" />
			<note deltatone="2" deltatime="0.2500" length="0.2500" />
			<note deltatone="1" deltatime="0.2500" length="0.2500" />
			<note deltatone="-3" deltatime="0.2500" length="0.2500" />
			<note deltatone="2" deltatime="0.2500" length="0.2500" />
			<note deltatone="-4" deltatime="0.2500" length="0.2500" />
			<note deltatone="4" deltatime="0.2500" length="0.2500" />
			<note deltatone="-2" deltatime="0.2500" length="1.7500" />
		</node>
		<node id="10" deltalength="1.0000" length="1.7500" tempo="180" beats-per-metre="2" beatlength="0.5000" deltatime-metre="0.0000">
			<note deltatone="0" deltatime="0.0000" length="0.5000" />
			<note deltatone="-5" deltatime="0.5000" length="0.2500" />
			<note deltatone="5" deltatime="0.2500" length="0.2500" />
			<note deltatone="0" deltatime="0.2500" length="0.7500" />
		</node>
		<node id="11" deltalength="0.7500" length="1.0000" tempo="180" beats-per-metre="2" beatlength="0.5000" deltatime-metre="0.0000">
			<note deltatone="0" deltatime="0.0000" length="0.2500" />
			<note deltatone="-2" deltatime="0.2500" length="0.2500" />
			<note deltatone="-2" deltatime="0.2500" length="0.2500" />
			<note deltatone="-1" deltatime="0.2500" length="0.2500" />
		</node>
		<node id="12" deltalength="0.7500" length="1.0000" tempo="180" beats-per-metre="2" beatlength="0.5000" deltatime-metre="0.0000">
			<note deltatone="0" deltatime="0.0000" length="0.2500" />
			<note deltatone="0" deltatime="0.2500" length="0.2500" />
			<note deltatone="-2" deltatime="0.2500" length="0.2500" />
			<note deltatone="-1" deltatime="0.2500" length="0.2500" />
		</node>
		<node id="13" deltalength="1.8330" length="2.0000" tempo="180" beats-per-metre="2" beatlength="0.5000" deltatime-metre="0.0000">
			<note deltatone="0" deltatime="0.0000" length="0.5000" />
			<note deltatone="2" deltatime="0.5000" length="0.2500" />
			<note deltatone="2" deltatime="0.2500" length="0.2500" />
			<note deltatone="5" deltatime="0.2500" length="0.2500" />
			<note deltatone="-5" deltatime="0.2500" length="0.2500" />
			<note deltatone="-2" deltatime="0.2500" length="0.1660" />
			<note deltatone="-2" deltatime="0.1660" length="0.1670" />
			<note deltatone="-3" deltatime="0.1670" length="0.1670" />
		</node>
		<node id="14" deltalength="2.0000" length="3.7500" tempo="180" beats-per-metre="2" beatlength="0.5000" deltatime-metre="0.0000">
			<note deltatone="0" deltatime="0.0000" length="0.2500" />
			<note deltatone="-1" deltatime="0.2500" length="0.2500" />
			<note deltatone="-1" deltatime="0.2500" length="0.2500" />
			<note deltatone="-7" deltatime="0.2500" length="0.2500" />
			<note deltatone="4" deltatime="0.2500" length="0.2500" />
			<note deltatone="-1" deltatime="0.2500" length="0.2500" />
			<note deltatone="-1" deltatime="0.2500" length="0.2500" />
			<note deltatone="-2" deltatime="0.2500" length="0.2500" />
			<note deltatone="-3" deltatime="0.2500" length="1.7500" />
		</node>
	</patterns>
	<chords>
		<node id="1" root="1" level="0" deltatime="1.0000" deltatone="0" deltalength="70.0000" length="72.0000">
			<chord deltatone="0" time="0.0000" deltatime="0.0000" length="4.0000" harmonyform="00000000000010010001000000000000" />
			<chord deltatone="7" time="4.0000" deltatime="4.0000" length="1.0000" harmonyform="00000000000010010001000000000000" />
			<chord deltatone="7" time="5.0000" deltatime="1.0000" length="1.0000" harmonyform="00000000000010001001000000000000" />
			<chord deltatone="5" time="6.0000" deltatime="1.0000" length="2.0000" harmonyform="00000000000010010001000000000000" />
			<chord deltatone="8" time="8.0000" deltatime="2.0000" length="2.0000" harmonyform="00000000000010001001000000000000" />
			<chord deltatone="2" time="10.0000" deltatime="2.0000" length="1.0000" harmonyform="00000000000010010001000000000000" />
			<chord deltatone="2" time="11.0000" deltatime="1.0000" length="1.0000" harmonyform="00000000000010001001000000000000" />
			<chord deltatone="5" time="12.0000" deltatime="1.0000" length="2.0000" harmonyform="00000000000010010001000000000000" />
			<chord deltatone="10" time="14.0000" deltatime="2.0000" length="1.0000" harmonyform="00000000000010010001000000000000" />
			<chord deltatone="5" time="15.0000" deltatime="1.0000" length="1.0000" harmonyform="00000000000010001001000000000000" />
			<chord deltatone="5" time="16.0000" deltatime="1.0000" length="1.0000" harmonyform="00000000000010001001000000000000" />
			<chord deltatone="11" time="17.0000" deltatime="1.0000" length="1.0000" harmonyform="00000000000010001001000000000000" />
			<chord deltatone="5" time="18.0000" deltatime="1.0000" length="1.0000" harmonyform="00000000000010010001000000000000" />